{
  "$schema": "http://json-schema.org/draft-07/schema#",
  "title": "TLCTC Reference Registry (Context) — Schema",
  "description": "Validates organization- or community-specific reference objects used by TLCTC instances (e.g., responsibility spheres, boundary contexts).",
  "type": "object",
  "additionalProperties": false,
  "required": ["metadata", "spheres", "boundary_contexts"],
  "properties": {
    "metadata": {
      "type": "object",
      "additionalProperties": false,
      "required": ["registry_id", "registry_version", "created_at"],
      "properties": {
        "registry_id": { "type": "string", "examples": ["@Org-registry"] },
        "registry_version": { "type": "string", "examples": ["1.0.0"] },
        "created_at": { "type": "string", "format": "date-time" },
        "owner": { "type": "string" },
        "notes": { "type": "string" }
      }
    },
    "spheres": {
      "type": "array",
      "minItems": 1,
      "items": { "$ref": "#/definitions/sphere_def" }
    },
    "boundary_contexts": {
      "type": "array",
      "minItems": 1,
      "description": "Allowed values for the boundary operator context label in this environment.",
      "items": { "$ref": "#/definitions/context_def" }
    },
    "intra_system_boundary_types": {
      "type": "array",
      "description": "Allowed intra-system boundary types for within-host boundary crossings (v2.1).",
      "items": { "$ref": "#/definitions/intra_system_type_def" }
    },
    "extensions": { "type": "object" }
  },
  "definitions": {
    "sphere_id": {
      "type": "string",
      "pattern": "^@[A-Za-z0-9_-]{1,64}$",
      "description": "Responsibility sphere identifier (e.g., @Org, @Vendor)."
    },
    "sphere_def": {
      "type": "object",
      "additionalProperties": false,
      "required": ["sphere_id", "description"],
      "properties": {
        "sphere_id": { "$ref": "#/definitions/sphere_id" },
        "description": { "type": "string" },
        "owner_contact": { "type": "string" },
        "typical_domain": { "type": "string", "examples": ["cyber", "human", "physical", "third-party"] },
        "notes": { "type": "string" }
      }
    },
    "context_id": {
      "type": "string",
      "pattern": "^[A-Za-z0-9_-]{1,32}$",
      "description": "Boundary context label (e.g., human, physical, auth, update, dev)."
    },
    "context_def": {
      "type": "object",
      "additionalProperties": false,
      "required": ["context", "description"],
      "properties": {
        "context": { "$ref": "#/definitions/context_id" },
        "description": { "type": "string" },
        "notes": { "type": "string" }
      }
    },
    "intra_system_type_def": {
      "type": "object",
      "additionalProperties": false,
      "required": ["type", "description"],
      "properties": {
        "type": { "type": "string", "enum": ["sandbox", "privilege", "process", "hypervisor"] },
        "description": { "type": "string" },
        "notes": { "type": "string" }
      }
    }
  }
}
